0,QDEL,47.61,0.116,873353,3202091487,0.0,29.74-75.07,0.95,QuidelOrtho Corporation,USD,0001906324,US2197981051,219798105,NASDAQ Global Select,NASDAQ,Medical - Instruments & Supplies,https://www.quidelortho.com,"QuidelOrtho Corporation focuses on the development and manufacture of diagnostic testing technologies across the continuum of healthcare testing needs. The company operates through Labs, Transfusion Medicine, Point-of-Care, and Molecular Diagnostics business units. The Labs business unit provides clinical chemistry laboratory instruments and tests that measure target chemicals in bodily fluids for the evaluation of health and the clinical management of patients; immunoassay laboratory instruments and tests, which measure proteins as they act as antigens in the spread of disease, antibodies in the immune response spurred by disease, or markers of proper organ function and health; testing products to detect and monitor disease progression across a spectrum of therapeutic areas; and specialized diagnostic solutions. The Transfusion Medicine business unit offers immunohematology instruments and tests used for blood typing to ensure patient-donor compatibility in blood transfusions; and donor screening instruments and tests used for blood and plasma screening for infectious diseases. The Point-of-Care business unit provides tests to provide rapid results across a continuum of point-of-care settings. The Molecular Diagnostics business unit offers polymerase chain reaction thermocyclers; and analyzers and amplification systems. The company sells its products directly to end users through a direct sales force; and through a network of distributors for professional use in physician offices, hospitals, clinical laboratories, reference laboratories, urgent care clinics, universities, retail clinics, pharmacies, wellness screening centers, blood banks, and donor centers, as well as for individual, non-professional, and over-the-counter use. It operates in North America, Europe, the Middle East, Africa, China, and internationally. The company was founded in 1979 and is headquartered in San Diego, California.",Mr. Brian J. Blaser,Healthcare,US,7100,858 552 1100,9975 Summers Ridge Road,San Diego,CA,92121,21.0447,107.355,https://images.financialmodelingprep.com/symbol/QDEL.png,1991-02-01,False,False,True,False,False,67300000.0,143700000,2755700000,5680880000,41.838038632986624,-27.73551263001486,1.4814264487369986,-1.438335794947994,2.135215453194651,47.35066864784547,-5.643387815750372,47.35066864784547,40.442793462109954,3202091487.0,5814091487.0,-1.7165718418514946,1.1372275054160599,32.13794383149448,-33.079457852060514,1.005476825556218,1.005476825556218,2.064883150548709,-4.142270936876603,58.31586245737212,-60.06292920519555,-0.5825564509559937,-0.03023024151339621,0.7974079769040073,0.37363073620443754,-1.8609290396124252,1.3750608390927674,0.16989485334809076,-0.053412621879352834,0.0,0.0,-0.0069645344476588445,0.06126362893774195,0.08193344461412792,0.5244004646307215,1.9709127281845538,0.06978726391305892,0.42763873558215454,0.015910785950207763,171.89863012032484,0.0050028240367247035,-0.577072899276572,-43.557206537890046,385300000,-379800000,-2201800000,5491000000,324000000.0,242300000.0,589500000.0,43.348368078985686,54.94671457280312,128.2534559405639,8.420155502392344,6.642799352750809,2.8459272097053727,-0.5088252531723207,2.9197622436849926,0.0,0.7935750775130804,0.0,0.0,-1.7165718418514946,4.336684680459389,-0.0069645344476588445,1.3750608390927674,0.8133943346636815,0.13988124209091793,43.348368078985686,128.25345594056392,171.60182401954958,54.94671457280312,116.65510944674647,0.41680576765990696,0.010903150193557552,-0.7102319139112832,-0.6629257378271833,0.0666066606660666,-0.27445560277014014,-0.5088252531723207,0.0053171221725726555,0.9333933393339334,-65.1400651465798,0.010903150193557552,0.37363073620443754,0.7974079769040073,0.4048001494209936,0.44364328363420513,0.16989485334809076,0.03923497697847389,2.1342140772586062,8.420155502392344,6.642799352750809,2.8459272097053727,1.8293269230769231,0.41400655776271483,1.4814264487369986,-1.438335794947994,2.135215453194651,0.03540860176865433,-0.9709127281845537,0.03923497697847389,0.2667201712145532,0.507379137442133,0.47589499033840094,1.005476825556218,1.005476825556218,1.1372275054160599,-1.7165718418514946,-33.079457852060514,32.13794383149448,32.13794383149448,4.336684680459389,1.1372275054160599,-4.142270936876603,1.005476825556218,0.0,QDEL,2023-12-31,2023,FY,-0.08211879975505205,-0.228099173553719,-0.8351309707241911,-0.8351309707241911,-1.018407144158921,-1.015527950310559,-1.0156903765690377,0.176056338028169,0.16376306620209058,0.0,-0.6834971196204677,-0.9047555077915099,7.939707718324255,2.656444863224526,0.13765751631514794,4.707084495326767,0.30916034373001033,-0.719428127039636,-1.7149109492111851,-1.0867323089420957,-1.007860237056983,10.714854747790504,6.493087504921733,1.3686556906603946,0,0,0,-0.16712141882673942,0.10246136233543217,-0.03305178527067007,-0.13741462885439756,-0.07455659008036251,0.29553805774278213,0.2289855072463768,2767333097.0,2881438485.0,3060595000.0,1120733737.0,1166944927.0,1239500975.0,2.45626,3.35425,4.7
0,QGEN,44.78,0.404,867158,9934308660,1.31959,39.03-47.44,-0.19,Qiagen N.V.,USD,0001015820,NL0015001WM6,N72482123,New York Stock Exchange,NYSE,Medical - Diagnostics & Research,https://www.qiagen.com,"QIAGEN N.V. offers sample to insight solutions that transform biological materials into molecular insights worldwide. The company provides primary sample technology consumables, such as nucleic stabilization and purification kits for primary sample materials, manual and automated processing for genotyping, gene expression, and viral and bacterial analysis, as well as silica membranes and magnetic bead technologies; secondary sample technology consumables, including kits and components for purification of nucleic acids from secondary sample materials; and instruments for nucleic acid purification and accessories. It also provides interferon-gamma release assay for TB testing, and assays for post-transplant testing and viral load monitoring; assays for prenatal testing and detection of sexually transmitted diseases and HPV, as well as assays for analysis of genomic variants, such as mutations, insertions, deletions, and fusions; and sample to insight instruments, including one-step molecular analysis of hard-to-diagnose syndromes, and integrated PCR testing. In addition, it offers PCR consumables, such as quantitative PCR, reverse transcription, and combinations kits for analysis of gene expression, genotyping, and gene regulation instruments and technologies; human ID and forensics assay consumables, including STR assays for human ID, and assays for food contamination; PCR instruments consist of digital PCR solutions; and developed and configured OEM consumables. Further, the company provides predefined and custom NGS gene panels, library prep kits and components, and whole genome amplification; QIAGEN consumables and instruments, as well as bioinformatics solutions; and custom laboratory and genomic services. It serves molecular diagnostics, academia, pharmaceutical, and applied testing customers. It has a strategic alliance agreement with Sysmex Corporation and OncXerna Therapeutics, as well as an agreement with Mirati. The company was founded in 1986 and is headquartered in Venlo, the Netherlands.",Mr. Thierry  Bernard,Healthcare,NL,5800,31 77 355 6600,Hulsterweg 82,Venlo,,5912 PL,-36.46936,81.27936433509961,https://images.financialmodelingprep.com/symbol/QGEN.png,1996-06-28,False,False,True,False,False,222314000.0,972985000,1919841000,11077704980,8.844130374155474,0.4180258553217521,2.849168293494787,2.067355182309706,6.658887879305847,15.878415214516405,3.206829079590129,15.878415214516405,8.838759592288385,9934308660.0,10881164660.0,107.12256055437788,5.052609107840913,15.716867305536699,21.615024869343475,2.8201806915252545,2.8201806915252545,5.534181949308657,30.715280797382707,17.178706777600606,23.67518996871206,0.009335101726702816,0.04626411517195601,0.5438652303658307,0.30618511667177284,2.6727789555099517,2.17450166937216,2.578723498526773,6.815770501328914,0.029468289414917373,2.9468289414917375,0.0,0.05800809084038341,0.09706923191945373,0.4492795042962765,0.27440046731185175,0.08839909387470285,0.8304807775006451,0.02279859259658606,12.220709156061616,0.017385512982789546,0.02691271618817269,-3.777556744064701,1325505000,712923000,-286130000,4902508000,357340500.0,77539500.0,321724500.0,64.15356168884341,29.141965379128052,118.64310815890195,5.689473668980644,12.524893062340226,3.07645345493769,0.025917944034052284,0.7818131111850806,1.31959,0.1932536088525359,0.029468289414917373,2.9468289414917375,107.12256055437788,3.8088021530445486,0.0,2.17450166937216,1.8894510565601719,0.8621412267581572,64.15356168884341,118.64310815890197,182.79666984774536,29.141965379128052,153.6547044686173,0.4966406838865736,0.059201779700067236,0.058067597272672716,0.04726590830719967,0.1860192167888518,0.014821384399884086,0.025917944034052284,0.02263893408100818,0.8139807832111482,0.9808420889854899,0.059201779700067236,0.30618511667177284,0.5438652303658307,0.2787950258428816,0.35227506887823207,2.578723498526773,0.32992836385929875,1.7762627925146615,5.689473668980644,12.524893062340226,3.07645345493769,2.587302548122727,0.31357451767464406,2.849168293494787,2.067355182309706,6.658887879305847,0.3221535835587288,0.7255995326881483,0.32992836385929875,1.1407510396086857,3.644308662432109,3.644308662432109,2.8201806915252545,2.8201806915252545,5.052609107840913,107.12256055437788,21.615024869343475,15.716867305536699,15.716867305536699,3.8088021530445486,5.052609107840913,30.715280797382707,2.8201806915252545,1.31959,QGEN,2023-12-31,2023,FY,-0.08228135369396848,-0.11674369458088941,-0.16221916983404208,-0.16221916983404208,-0.19353939287967467,-0.19791666666666663,-0.1947368421052631,0.0025002531147841007,0.002098759380151076,0,-0.35764277245884035,-0.47581141063880916,0.5362524737949669,0.3334760493468563,0.05206823229910923,0.8057278008787292,0.30235336019642683,-0.06551480509474246,4.028850725578539,0.826832370594274,3.6404586076671066,0.42772319230832695,0.4725642877797503,0.5353921327326199,0,0,0,0.54607247584838,0.11293161247066712,-0.02744151908437617,0.09567164304761404,-0.1344784979451503,0.04557066033214122,-0.04102857048241148,2083692627.0,2222292626.0,2380155737.0,685062235.0,730630197.0,782531352.0,2.28905,2.52196,2.73497
0,QSI,4.1,2.928,0,585122689,0.0,,,Quantum-Si incorporated,USD,0001816431,US74765K1051,74765K105,NASDAQ Global Market,NASDAQ,Biotechnology,https://www.quantum-si.com,"Quantum-Si incorporated, a life sciences company, develops a single molecule detection platform for sample preparation and sequencing. It offers a proprietary single molecule detection platform for use in semiconductor industry to field proteomics to enable next generation protein sequencing. The company was incorporated in 2013 is based in Guilford, Connecticut.",Mr. Jeffrey Alan Hawkins,Healthcare,US,159,203 458 7100,530 Old Whitfield Street,Guilford,CT,06437,3.2416,0.8573007050253572,https://images.financialmodelingprep.com/symbol/QSI.png,2020-11-13,False,False,True,False,False,142399000.0,42268000,13825000,97181397,0.015913033097142537,-0.6315634239004487,-0.6031151904156631,-0.6226448219439743,1.3788299075133954,1.4783811684070816,1.4783811684070816,1.4783811684070816,0.0,585122689.0,556679689.0,-6.491826228122845,258.21830935569284,-6.798038028480606,-6.59932654741496,2.7733037241117233,2.7733037241117233,245.66623521624007,-6.293081416249336,-6.481837953960621,-6.278531185148426,-0.15403985948791435,-0.15153061343686844,0.0,0.0,0.32153879198272645,13.415982270890366,0.0,0.9549558565170013,0.0,0.0,0.0,4.458517210944396,25.86672506619594,0.0,-0.0323812628808961,1.2272727272727273,0.5918280485209619,3.5675198587819947,4.5834548249497615,-0.5690459309305194,-0.3803445913370042,1.2164551717357566,190486000,210520000,179894000,220417000,810000.0,1766000.0,4472500.0,164.62047661076787,241.64975399753996,459.1682041820418,2.2172211350293543,1.5104505341384116,0.7949156685406991,-0.3711794628393367,0.019529631528311293,0.0,0.0,0.0,0.0,-6.491826228122845,4.089850523717389,0.0,13.415982270890366,13.149328640333724,2.755051492634598,164.62047661076787,459.16820418204185,623.7886807928096,241.64975399754,382.13892679526964,-0.4351279788172992,-46.45984112974404,-39.66946160635481,-39.68843777581642,-0.13789727558932485,-0.3803445913370042,-0.3711794628393367,-0.47612974420203336,1.0004783571214027,0.8538441079807747,-46.45984112974404,0.0,0.0,0.0,0.0,0.0,0.0,1.1231901957058712,2.2172211350293543,1.5104505341384116,0.7949156685406991,0.075707460492466,0.00958325932316645,-0.6031151904156631,-0.6226448219439743,1.3788299075133954,-37.90070609002648,1.0323812628808962,0.0,0.0,-30.882056814095648,-30.882056814095648,2.7733037241117233,2.7733037241117233,258.21830935569284,-6.491826228122845,-6.59932654741496,-6.798038028480606,-6.798038028480606,4.089850523717389,258.21830935569284,-6.293081416249336,2.7733037241117233,0.0,QSI,2023-12-31,2023,FY,0,1.1888544891640866,0.10230860538916837,0.10230860538916837,0.31964010975376306,0.3267326732673267,0.3267326732673267,0.014684335042562991,0.014684335042562991,0,-0.03838339222614841,0.01966416915923831,0,0,0,-1.9560850513767971,-1.9560850513767971,0.8901150538187957,-1.587723783880722,-1.587723783880722,0.9002372074435779,6.395111341321783,6.395111341321783,-0.7135247484014563,0,0,0,0,20.150485436893202,-0.23815727294787795,-0.2537393377299696,-0.1228361802132294,-0.06989814326552135,0.05527709476073388,8601500.0,21133000.0,59499500.0,5160900.0,12679800.0,35699700.0,-0.79,-0.755,-0.605
0,QTRX,11.87,1.362,394735,457283441,0.0,9.87-29.7,-0.21,Quanterix Corporation,USD,0001503274,US74766Q1013,74766Q101,NASDAQ Global Market,NASDAQ,Medical - Devices,https://www.quanterix.com,"Quanterix Corporation, a life sciences company, engages in development and marketing of digital immunoassay platforms that advances precision health for life sciences research and diagnostics in North America, Europe, the Middle East, Africa, and the Asia Pacific regions. It offers HD-X instrument, a sensitive automated multiplex protein detection platform; and SR-X instrument that enables researchers to apply Simoa detection technology in various applications, including direct detection of nucleic acids. The company also provides SP-X instrument that is based on Simoa planar array technology for the measurement of multiplex chemiluminescent immunoassays. The company's products include assay kits and other consumables such as reagents. In addition, it offers contract research services, including sample testing, homebrew assay development, and custom development services. The company primarily operates in the areas of neurology, oncology, cardiology, infectious diseases, and inflammation. It sells its products for the life science research sector primarily to laboratories associated with academic and governmental research institutions, as well as pharmaceutical, biotechnology, and contract research companies through a direct sales force, support organizations, and distributors or sales agents. The company was formerly known as Digital Genomics, Inc. and changed its name to Quanterix Corporation in August 2007. Quanterix Corporation was incorporated in 2007 and is headquartered in Billerica, Massachusetts.",Dr. Masoud  Toloue Ph.D.,Healthcare,US,441,617 301 9400,Building 1,Billerica,MA,01821,8.48665,22.7666,https://images.financialmodelingprep.com/symbol/QTRX.png,2017-12-07,False,False,True,False,False,38449000.0,29339000,38491000,507451040,3.469713126479232,-1.0483237535436551,-0.9583084085411844,-1.092824260708991,7.634086712268199,8.813805300527973,8.689432755078155,8.813805300527973,0.32224505188691516,457283441.0,466435441.0,-11.322837968591063,3.4277319855779678,-12.386409108179992,-10.883036817554382,1.3467508749358181,1.3467508749358181,3.4963340829191867,-10.781892258616306,-12.659052298756988,-11.10084823171022,-0.08831708117469715,-0.09188611752070856,0.0,0.0,-0.21155313099558493,10.066385033192516,-4.59225181598063,0.9372710622710623,0.0,0.0,0.0,0.7568118614465508,0.22393127047306363,0.0116343005065373,-0.14036801823807196,0.038768580359351455,0.4914014251781473,0.14598934088915874,14.418520477225814,-0.1703632833740206,-0.09921869615305087,6.792900985721345,330506000,334100000,294816000,369826000,31436500.0,6825500.0,30666000.0,85.05914232386606,38.235525991623554,197.64613615833127,4.291131911608607,9.546095954844779,1.8467348114895812,-0.11820243269973071,0.1345158521678067,0.0,0.0,0.0,0.0,-11.322837968591063,11.888979867020605,0.0,10.066385033192516,9.161984967356121,0.8048225160476217,85.05914232386607,197.64613615833127,282.70527848219734,38.235525991623554,244.4697524905738,0.5436146529042704,-0.426499359104095,-0.2977654845697752,-0.3021355700975211,-0.014676266237035546,-0.09806435602613947,-0.11820243269973071,-0.1519013700970708,1.0146762662370354,0.698161622552638,-0.426499359104095,0.0,0.0,0.0,0.0,-4.59225181598063,0.0,1.2128882619908994,4.291131911608607,9.546095954844779,1.8467348114895812,3.862615090624819,0.32457070842233826,-0.9583084085411844,-1.092824260708991,7.634086712268199,-0.2761924036969574,1.140368018238072,0.0,0.0,-7.124129930394432,-7.124129930394432,1.3467508749358181,1.3467508749358181,3.4277319855779678,-11.322837968591063,-10.883036817554382,-12.386409108179992,-12.386409108179992,11.888979867020605,3.4277319855779678,-10.781892258616306,1.3467508749358181,0.0,QTRX,2023-12-31,2023,FY,0.1659425261071728,0.5279435937364824,0.38565722735879043,0.38565722735879043,0.6656256463288521,0.6704980842911877,0.6704980842911877,0.016302224070120906,0.016302224070120906,0,0.60842724560822,0.6218207273575785,3.3311240457352094,0.9024029246959729,0.11502199354943674,0.34899015649510934,0.6149650568291856,0.363269488011169,0.12568196560530445,0.39065996541889997,0.19285947785967228,10.842772448571298,3.8842322413366874,0.32471093165538417,0,0,0,0.3363832360519535,0.3323603002502085,-0.021160804147407064,-0.048971862867478816,-0.05985851623435516,-0.03989957512553109,-0.03250672756317477,158411167.0,188426600.0,222233333.0,-76513083.0,-91010630.0,-107339387.0,-0.86167,-0.606,-0.32333
0,RGEN,154.04,0.959,573575,8630352868,0.0,113.5-211.13,4.14,Repligen Corporation,USD,0000730272,US7599161095,759916109,NASDAQ Global Select,NASDAQ,Medical - Instruments & Supplies,https://www.repligen.com,"Repligen Corporation develops and commercializes bioprocessing technologies and systems for use in biological drug manufacturing process in North America, Europe, the Asia Pacific, and internationally. It offers Protein A ligands that are the binding components of Protein A affinity chromatography resins; and cell culture growth factor products. The company's chromatography products include OPUS pre-packed chromatography columns, which are used in the purification of biologics; and OPUS smaller-scale columns that are used in the high throughput process development screening, viral clearance validation studies, and scale down validation of chromatography processes. It also offers ELISA test kits; and chromatography resins under the CaptivA brand. In addition, the company provides filtration products, such as XCell Alternating Tangential Flow systems that are filtration devices used in upstream perfusion and cell culture processing; TangenX flat sheet cassettes, which are used in downstream biologic drug concentration and formulation processes; KrosFlo tangential flow filtration and tangential flow depth filtration systems; Spectra/Por laboratory and process dialysis products, and SpectraFlo dynamic dialysis systems; and ProConnex single-use hollow fiber. Further, it provides process analytics products, such as slope spectroscopy systems under the SoloVPE, FlowVPE, and FlowVPX brands. The company sells its products to life sciences, biopharmaceutical, and diagnostics companies; laboratory researchers; and contract manufacturing organizations. Repligen Corporation has collaboration agreements with Navigo Proteins GmbH to develop multiple affinity ligands. Repligen Corporation was incorporated in 1981 and is headquartered in Waltham, Massachusetts.",Mr. Olivier  Loeillot,Healthcare,US,1783,781 250 0111,Building 1,Waltham,MA,02453,83.35695,72.04804899236683,https://images.financialmodelingprep.com/symbol/RGEN.png,1986-04-29,False,False,True,False,False,56013038.0,783964000,672471000,8224367315,10.998028708958797,-0.37003884702700823,2.950795134518503,2.3432937167235957,13.996098551198026,36.003867528128005,11.574305253716108,36.003867528128005,9.637738270864723,8630352868.0,8518859868.0,-416.2806182042746,14.009562585121252,52.202878538748685,65.75256461087196,4.278429251514614,4.278429251514614,13.828577150899383,97.60939407619593,51.541053030257196,64.90312649422879,-0.002402225701291926,0.015208532259054323,0.25864561959571297,0.1842714944019806,-1.2774906903466055,10.442112839820608,-0.28526766125493636,-7.974669497249831,0.0,0.0,-0.014666859651662083,0.09899794329199897,0.0678664941650853,0.4834143749620228,0.2058771924517343,0.055237300599156214,0.49958157767239736,0.07712411510422332,17.313684375198324,-0.016277455487741458,-0.014174536850239696,2.820914659190598,1023204000,648312000,317612000,2721429000,126135500.0,21133500.0,186496500.0,76.4479987273409,23.823553681122217,203.53817120503652,4.774487312634663,15.320972046635763,1.7932754226838024,-0.010435436682772694,0.607501417794907,0.0,0.060438664325538446,0.0,0.0,-416.2806182042746,12.738186917050804,-0.014666859651662083,10.442112839820608,8.758328257940683,7.234409316575309,76.4479987273409,203.53817120503652,279.98616993237744,23.823553681122217,256.1626162512552,0.4688433898833342,-0.008442729529099902,-0.00423516272667211,-0.03364592481246946,-6.944039862016098,-0.007322361978404914,-0.010435436682772694,-0.0019105322821548717,7.944423150632426,0.5016343010959431,-0.008442729529099902,0.1842714944019806,0.25864561959571297,0.20549518908967562,0.20549518908967562,-0.28526766125493636,0.3168726646689941,1.403611667855085,4.774487312634663,15.320972046635763,1.7932754226838024,1.8676099208430472,0.21762998102198652,2.950795134518503,2.3432937167235957,13.996098551198026,0.26830218511021325,0.7941228075482657,0.3168726646689941,0.0,4.857264605618902,4.814254922521263,4.278429251514614,4.278429251514614,14.009562585121252,-416.2806182042746,65.75256461087196,52.202878538748685,52.202878538748685,12.738186917050804,14.009562585121252,97.60939407619593,4.278429251514614,0.0,RGEN,2023-12-31,2023,FY,-0.21106226045991697,-0.3223130702689892,-0.6429683406930619,-0.6429683406930619,-0.8085814615049554,-0.8089552238805969,-0.8055555555555556,0.0046880634691669676,-0.018762509790270648,0,-0.33800549734721036,0.934326354648011,4.271945259373782,1.5599299143513512,0.6284369278348746,1.4968152465636562,1.7305591046474362,0.7156918243914181,0.2570600483745862,0.6826130368138116,-0.4397516616509488,9.783752716223137,100.4567354153033,27.268631322662014,0,0,0,0.06807917623680611,-0.15090000293775732,0.12141327657052955,0.023539364460941157,0.682906934681921,-0.027631099781500364,0.0048973956233870335,696721450.0,797206584.0,906211000.0,183838734.0,210353003.0,239115192.0,1.74385,2.23177,2.70277
