0,LH,229.92,1.036,585479,19230347856,2.88,191.97-247.99,0.77,Laboratory Corporation of America Holdings,USD,0000920148,US50540R4092,50540R409,New York Stock Exchange,NYSE,Medical - Diagnostics & Research,https://www.labcorp.com,"Laboratory Corporation of America Holdings operates as a global life sciences company that provides vital information to help doctors, hospitals, pharmaceutical companies, researchers, and patients make clear and confident decisions. It operates in two segments, Labcorp Diagnostics (Dx) and Labcorp Drug Development (DD). It offers various tests, such as blood chemistry analyses, urinalyses, blood cell counts, thyroid tests, PAP tests, hemoglobin A1C and vitamin D, prostate-specific antigens, tests for sexually transmitted diseases, hepatitis C tests, microbiology cultures and procedures, and alcohol and other substance-abuse tests. The company also provides specialty testing services comprising gene-based and esoteric testing; advanced tests target specific diseases, including anatomic pathology/oncology, cardiovascular disease, coagulation, diagnostic genetics, endocrinology, infectious disease, women's health, pharmacogenetics, and parentage and donor testing; and occupational testing services, medical drug monitoring services, chronic disease programs, and kidney stone prevention tests. It provides online and mobile applications to enable patients to check test results; and online applications for managed care organizations and accountable care organizations. It offers end-to-end drug development, medical device, and companion diagnostic development solutions from early-stage research to clinical development and commercial market access. It serves managed care organizations, pharmaceutical, biotechnology, medical device and diagnostics companies, governmental agencies, physicians and other healthcare providers, hospitals and health systems, employers, patients and consumers, contract research organizations, and independent clinical laboratories. Laboratory Corporation of America Holdings has a collaboration agreement with Tigerlily Foundation to increase clinical trial diversity for women of color. The company was incorporated in 1994 and is headquartered in Burlington, North Carolina.",Mr. Adam H. Schechter,Healthcare,US,67000,336 229 1127,358 South Main Street,Burlington,NC,27215,-48.4258,280.4158013477766,https://images.financialmodelingprep.com/symbol/LH.png,1990-03-29,False,False,True,False,False,84000000.0,1517300000,7719100000,24974120000,151.34285714285716,5.184523809523809,16.526190476190475,10.03809525,18.063095238095237,97.4452380952381,-21.877380952380953,97.26428571428572,82.68690476190476,19230347856.0,25432147856.0,44.3473708381171,1.5126760317160657,13.912462181241896,22.806389745248588,2.3638686935448336,2.3638686935448336,2.00051506009691,17.973249380899823,18.32023329203285,30.16146563785405,0.02254925108526361,0.04384736081292028,0.826417957944726,0.36276695768972467,4.382897529599221,1.4390093786635405,5.774909654104285,3.185406149609913,0.012526096033402923,1.2526096033402923,0.5605051664753157,0.0,0.00015732175445220566,0.5385144392209537,0.39259472626422703,0.04287017800956516,0.8749397961149462,0.00915612610911837,106.51785115555006,0.052077577483618895,0.05070202808112324,-83.32916666666667,1497900000,-1837700000,-5517200000,14571000000,2235600000.0,710750000.0,462450000.0,63.876722673211255,25.81419613046828,18.869478212481805,5.71413160733549,14.139506733242548,19.343407162078243,0.05441947354938677,6.4880952261904765,2.88,0.35111169337965614,0.012526096033402923,1.2526096033402923,44.3473708381171,-23.504106544202145,0.5605051664753157,1.4390093786635405,1.2974208675263774,0.4446951934349355,63.876722673211255,18.86947821248181,82.74620088569306,25.814196130468282,56.93200475522478,0.26492983449751434,0.08799005726511862,0.049446227424328235,0.03425681203196778,0.3052815781100859,0.023398253861652115,0.05441947354938677,0.07358968454985033,0.6928094177537385,0.5619524405506884,0.08799005726511862,0.36276695768972467,0.826417957944726,0.39579805210652036,0.4524801972899438,5.774909654104285,0.20559834123222748,2.2780960074416785,5.71413160733549,14.139506733242548,19.343407162078243,4.168131147540984,0.6830248488918738,16.526190476190475,10.03809525,18.063095238095237,0.10919702976527594,0.6074052737357729,0.20559834123222748,0.9916422601614401,2.547155967976433,1.7592193660616138,2.3638686935448336,2.3638686935448336,1.5126760317160657,44.3473708381171,22.806389745248588,13.912462181241896,13.912462181241896,-23.504106544202145,1.5126760317160657,17.973249380899823,2.3638686935448336,2.88,LH,2023-12-31,2023,FY,-0.18251236825123682,-0.23265147887163348,-0.5909577766503185,-0.5909577766503185,-0.6732077241810648,-0.658119658119658,-0.6583094555873926,-0.043907793633369926,-0.043668122270742356,0.3609874649451358,-0.32118206452272613,-0.4069877883310719,1.0601760895118755,0.24925270413246908,-0.028092732372705962,0.5956507172960632,0.18406664395198818,-0.30539846222776584,-0.28323233552056337,-0.44933024140359656,-0.6999224783380926,2.1228523918928897,0.31507451125472546,-0.06009638729258052,0.0,0.0,0.0,0.050768537024983726,0.008499787505312367,-0.17018025219423372,-0.18260948274240305,-0.05412317908147866,0,0.012421115897024942,,,,,,,,,
0,LUCD,0.8247,1.416,463759,48939743,0.0,0.63-1.58,0.0047,Lucid Diagnostics Inc.,USD,0001799011,US54948X1090,54948X109,NASDAQ Global Market,NASDAQ,Medical - Devices,https://www.luciddx.com,"Lucid Diagnostics Inc. operates as a commercial-stage medical diagnostics technology company. The company focuses on patients with gastroesophageal reflux disease, which is also known as chronic heartburn, acid reflux, or simply reflux, who are at risk of developing esophageal precancer and cancer, specifically highly lethal esophageal adenocarcinoma. Its lead products include EsoGuard, a laboratory developed esophageal DNA test; and EsoCheck, an esophageal cell collection device. The company was incorporated in 2018 and is based in New York, New York. Lucid Diagnostics Inc. is a subsidiary of PAVmed Inc.",Dr. Lishan  Aklog M.D.,Healthcare,US,70,212 949 4319,One Grand Central Place,New York,NY,10165,1.94238,-0.9632761871808547,https://images.financialmodelingprep.com/symbol/LUCD.png,2021-10-14,False,False,True,False,False,50374146.0,14489000,13066000,39631928,0.08315771745291722,-0.8897024279081575,-0.8783870996046266,-0.8895436162828447,0.2876277048944909,0.12581851015399845,0.1091035865898352,0.12581851015399845,0.2030803658686343,48939743.0,47516743.0,-0.9269391361997411,11.682920669114509,-0.9388799088365576,-1.0921611916982816,6.5546794266645625,6.5546794266645625,11.34322137579885,-1.099568264914148,-1.0738732372084614,-1.0604048873019416,-1.078819483337162,-0.9156157603851741,1.6093404859577154,0.4513673776440393,0.03292914333317906,1.180714436100779,-1504.3666666666666,0.9872818956669196,0.0,0.0,0.0,4.415613372072898,1.5414183674906583,0.03725993450747854,-0.012701139034532634,0.13416092961588197,0.3570520965692503,1.0327049493208282,1.5870328490915022,-339.78956777479266,-2.060029417172274,-0.028114620543641573,2575000,5496000,564000,7217000,99500.0,1019000.0,667000.0,3.398186535733238,53.3172526791831,30.581085016870656,107.41023076923076,6.8458140969163,11.935482334869432,-5.619811912225705,0.011156516678218228,0.0,0.20841956607741075,0.0,0.0,-0.9269391361997411,-0.11020276397041358,0.0,1.180714436100779,1.1350270194399608,1.016843287248228,3.3981865357332386,30.58108501687066,33.97927155260389,53.3172526791831,-19.33798112657921,-0.8548581653994188,-10.773695577392116,-10.698976056093592,-10.698976056093592,-123.51396760230264,-1.9832728560049562,-5.619811912225705,-5.405557551802611,1.0,0.9930646340652767,-10.773695577392116,0.4513673776440393,1.6093404859577154,0.0,0.6167613979925021,-1504.3666666666666,-4.338039215686274,3.5654780687914167,107.41023076923076,6.8458140969163,11.935482334869432,1.1023681578947369,0.18537034250818657,-0.8783870996046266,-0.8895436162828447,0.2876277048944909,-10.562905362355064,1.0127011390345326,-4.338039215686274,-4.338039215686274,-78.73309608540926,-78.73309608540926,6.5546794266645625,6.5546794266645625,11.682920669114509,-0.9269391361997411,-1.0921611916982816,-0.9388799088365576,-0.9388799088365576,-0.11020276397041358,11.682920669114509,-1.099568264914148,6.5546794266645625,0.0,LUCD,2023-12-31,2023,FY,5.440318302387268,-0.8690145196169292,0.13688558152783464,0.13688558152783464,0.06239874668423208,0.1870967741935484,0.1870967741935484,0.15436367944517732,0.15436367944517732,0,-0.1055078322385043,-0.07992024319288726,0,0,0,-254.69774509277195,-254.69774509277195,-4.165153979614318,-40.43941360802599,-40.43941360802599,-4.6352581839093965,-0.9265732038060968,-0.9265732038060968,0.8485514574835069,0,0,0,1.6470588235294117,1.5045045045045045,-0.1611553723584238,-1.086864613150162,6.631315657828915,-0.36752136752136755,-0.1044978527838469,10924333.0,33509800.0,33299999.0,-2184866.0,-6701959.0,-6659999.0,-0.615,-0.406,-0.47
0,MASS,2.2,0.976,302156,76610160,0.0,1.81-9.1,-0.09,908 Devices Inc.,USD,0001555279,US65443P1021,65443P102,NASDAQ Global Market,NASDAQ,Medical - Devices,https://www.908devices.com,"908 Devices Inc., a commercial-stage technology company, provides various purpose-built handheld and desktop mass spectrometry (Mass Spec) devices to interrogate unknown and invisible materials in life sciences research, bioprocessing, industrial biotech, forensics, and adjacent markets. The company's products include MX908, a handheld, battery-powered, and Mass Spec device that is designed for rapid analysis of gas, liquid, and solid materials of unknown identity; Rebel, a small desktop analyzer that provides real-time information on the extracellular environment in bioprocesses; and ZipChip solution, a plug-and-play, high-resolution separation platform that optimizes Mass Spec sample analysis. It operates in the Americas, Europe, the Middle East, Africa, and the Asia Pacific. The company was incorporated in 2012 and is headquartered in Boston, Massachusetts.",Dr. Kevin J. Knopp Ph.D.,Healthcare,US,230,857 254 1500,645 Summer Street,Boston,MA,02210,,0.0,https://images.financialmodelingprep.com/symbol/MASS.png,2020-12-18,False,False,True,False,False,34670638.0,45025000,7179000,82461113,1.5910292738195357,-1.7360222791400608,-0.8633818621970556,-0.8848697852055679,2.0676285218633703,3.779538178674416,2.140687460092312,3.779538178674416,0.0,76610160.0,38764160.0,-1.2672648424130657,1.3888212900184909,-2.5481193158281554,-2.4971531014700608,0.5820816978151543,0.5820816978151543,0.7027330408614626,-0.6853271573289961,-1.2949876394735083,-1.2635405326118843,-0.7891010359727548,-0.400456023065348,0.0,0.0,0.6690946378374556,4.235438214480131,0.0,0.49733339979065944,0.0,0.0,0.0,0.0,0.420978209637069,0.318706775183276,-0.02488808712500835,0.013505674196004496,0.22074074074074074,0.20443421195750697,12.150335627808097,-0.5030846215375945,-0.4955336192914715,1.3225239754745788,83209000,74219000,61683000,151179000,13823000.0,1934500.0,18211000.0,110.23050288241906,24.235283812193412,228.06744919411352,3.311243171859055,15.060686015831134,1.6004037458644087,-0.3948230679160749,0.021487923008512273,0.0,0.0,0.0,0.0,-1.2672648424130657,0.023505718851210083,0.0,4.235438214480131,3.5420328174819193,1.7507193405397,110.23050288241906,228.06744919411352,338.29795207653257,24.235283812193412,314.06266826433915,0.4826148435517204,-1.1993219970269389,-1.0949929299155217,-1.091131576084986,0.0035263732988973875,-0.3376036974921894,-0.3948230679160749,-0.43363156687313603,0.9964736267011026,0.9130099611530148,-1.1993219970269389,0.0,0.0,0.0,0.0,0.0,0.0,1.360533886858111,3.311243171859055,15.060686015831134,1.6004037458644087,4.947264573991031,0.30940695411228214,-0.8633818621970556,-0.8848697852055679,2.0676285218633703,-0.5426561763532867,1.0248880871250083,0.0,0.0,-40.17986577181208,-40.17986577181208,0.5820816978151543,0.5820816978151543,1.3888212900184909,-1.2672648424130657,-2.4971531014700608,-2.5481193158281554,-2.5481193158281554,0.023505718851210083,1.3888212900184909,-0.6853271573289961,0.5820816978151543,0.0,MASS,2023-12-31,2023,FY,0.0720780329548365,-0.026937708949775197,-0.20846758238652421,-0.20846758238652421,-0.14664188508064516,-0.1188118811881187,-0.1188118811881187,0.022830842017747002,0.023715527977093996,0,-0.1972766364070712,-0.1797170837867247,0.34221699534134586,0.34221699534134586,0.5813287834217945,-0.6596897299260176,-0.6596897299260176,-6.136077706517237,-1.8464537681267392,-1.8464537681267392,-3.443277244409427,2.943720949236596,2.943720949236596,0.007754026989212713,0,0,0,-0.10405661317651749,0.1937984496124031,-0.16326513786806382,-0.1511128736238014,-0.6389968423609425,0.24980029670204268,0.052348503840105746,65916600.0,84980333.0,115200000.0,-37848673.0,-48794884.0,-66146725.0,-1.256,-0.97667,-0.39
0,ME,3.78,1.261,339173,103322641,0.0,2.655-17.04,-0.01,23andMe Holding Co.,USD,0001804591,US90138Q1085,90138Q108,NASDAQ Global Select,NASDAQ,Medical - Diagnostics & Research,https://www.23andme.com,"23andMe Holding Co. operates as a consumer genetics testing company. It operates through two segments, Consumer & Research Services and Therapeutics. The Consumer & Research Services segment provides a suite of genetic reports, including information on customers' genetic ancestral origins, personal genetic health risks, and chances of passing on certain rare carrier conditions to their children, as well as reports on how genetics can impact responses to medications based on genetic testing of a saliva sample through its spit kit. The Therapeutics segment focuses on the drug development; and discovery and development of novel therapies to improve patient lives across various therapeutic areas, including oncology, respiratory, and cardiovascular diseases, as well as offers out-licensing of intellectual property associated with identified drug targets related to drug candidates under clinical development. It has a collaboration agreement with GlaxoSmithKline Intellectual Property (No.3) Limited to leverage genetic insights to validate, develop, and commercialize drugs. The company was founded in 2006 and is headquartered in South San Francisco, California.",Ms. Anne  Wojcicki,Healthcare,US,560,650 938 6300,349 Oyster Point Boulevard,South San Francisco,CA,94080,6.56395,-2.313946688832079,https://images.financialmodelingprep.com/symbol/ME.png,2020-11-23,False,False,True,False,False,25519658.0,126601000,71688000,122448623,7.572985500040792,-24.111373279375453,-5.169622570960787,-5.341803561787544,4.960920714533087,3.994136598539056,2.8461980172304817,3.994136598539056,0.0,103322641.0,48409641.0,-0.1567724889081022,0.5346302442305703,-0.731194579123303,-0.7579363487650472,0.9463872621138243,0.9463872621138243,0.2504897081651661,-0.12203608674936915,-0.3669426349420513,-0.35511506664417075,-6.378670179728956,-1.3193720048251574,0.0,0.0,0.13843043437707186,1.2352467758504493,0.0,0.22160761139424642,0.0,0.0,0.0,0.6431232536479354,0.8912346062299493,0.09185228384378057,-0.03330629818005412,0.02273621028666046,0.226401483924155,0.46879850977957155,46.54935730237614,-4.642936980863849,-2.1244022773019013,-2.521996964065898,35953000,72634000,-28223000,135166000,26297500.0,8839000.0,14796500.0,46.89511538859567,21.68773704171934,49.64171201377819,7.783326621022956,16.829787234042552,7.35268759261754,-3.0343133931092128,0.17218099082675795,0.0,0.0,0.0,0.0,-0.1567724889081022,-0.04819370747257318,0.0,1.2352467758504493,1.1381067977046542,0.828372516047137,46.89511538859568,49.641712013778196,96.53682740237386,21.68773704171934,74.84909036065451,0.43517541136293075,-2.448789195901894,-3.18388699161751,-3.1838662941115596,6.500703701175653e-06,-1.9292710763287932,-3.0343133931092128,-2.8491195328256222,0.9999934992962988,1.3001882713897217,-2.448789195901894,0.0,0.0,0.0,0.0,0.0,0.0,3.129001559909349,7.783326621022956,16.829787234042552,7.35268759261754,2.764095082811293,0.6059522913688012,-5.169622570960787,-5.341803561787544,4.960920714533087,-0.6826399668839905,1.033306298180054,0.0,0.0,-30.024351388256715,-30.024351388256715,0.9463872621138243,0.9463872621138243,0.5346302442305703,-0.1567724889081022,-0.7579363487650472,-0.731194579123303,-0.731194579123303,-0.04819370747257318,0.5346302442305703,-0.12203608674936915,0.9463872621138243,0.0,ME,2024-03-31,2023,FY,-0.26662414980182914,-0.26111557221032594,0.008194166247442217,0.008194166247442217,-1.1392304335549452,0.8985948138490512,-1.0288280457771983,20.084282109701,0.05421409441095984,0,0.006475603119898422,0.01539375760491242,-0.9787316225383818,-0.9787316225383818,-0.9615561347047085,0.9284992659905474,0.9284992659905474,0.9055185379679275,0.8449092575744194,0.8449092575744194,0.8447663160184437,-0.9743510207841075,-0.9743510207841075,1.0135131272288598,0,0,0,3.783869267264101,0.2164535961744901,-0.5807682596398465,-0.9874761601323474,-0.10303151083184844,-0.07742726733634027,-0.127874495042622,166683018.0,198421589.0,251394751.0,-137232142.0,-163362891.0,-206976336.0,-12.58875,-10.64002,-7.80164
0,MLAB,144.19,0.865,37425,783156450,0.64,83.68-147.3359,5.84,"Mesa Laboratories, Inc.",USD,0000724004,US59064R1095,59064R109,NASDAQ Global Select,NASDAQ,"Hardware, Equipment & Parts",https://www.mesalabs.com,"Mesa Laboratories, Inc. develops, manufactures, and sells life sciences tools and quality control products and services in the United States, Europe, the Asia Pacific, and internationally. The company's Sterilization and Disinfection Control segment manufactures and sells biological, cleaning, and chemical indicators that are used to assess the effectiveness of sterilization and disinfection processes in the hospital, dental, medical device, and pharmaceutical industries. This segment also provides testing and laboratory services primarily to the dental industry. Its Biopharmaceutical Development segment develops, manufactures, and sells automated systems for protein analysis (immunoassays) and peptide synthesis solutions. This segment's solutions include protein analysis comprising analysis equipment, CDs, kits, and buffers; and peptide synthesizers that enables to automate chemically synthesized peptides that are used in the creation of peptide therapies, biomaterials, cosmetics, and general research. The company's Calibration Solutions segment designs, manufactures, and markets quality control and calibration products to measure or calibrate temperature, pressure, pH, humidity, and other such parameters used for health and safety purposes in the hospital, medical device manufacturing, pharmaceutical manufacturing, and various laboratory and healthcare environments. This segment's products include continuous monitoring systems, dialysate meters and consumables, data loggers, gas flow calibration and air sampling equipment, and torque testing systems. Its Clinical Genomics segment develops, manufactures, and sells genetic analysis tools that include MassARRAY system and consumables, including chips, panels, and chemical reagent solutions used by clinical labs to perform genomic clinical testing in several therapeutic areas, such as newborn screenings, pharmacogenetics, and oncology. The company was incorporated in 1982 and is headquartered in Lakewood, Colorado.",Mr. Gary M. Owens,Technology,US,736,303 987 8000,12100 West Sixth Avenue,Lakewood,CO,80228,-73.51334,214.7733394464556,https://images.financialmodelingprep.com/symbol/MLAB.png,1984-02-29,False,False,True,False,False,5413000.0,24337000,222855000,901450180,42.191021614631445,-45.38167374838352,7.412155920931092,6.610012931830778,4.496028080546831,29.82652872713837,-9.088675411047479,29.82652872713837,39.642711989654536,783156450.0,981674450.0,-3.1772737338744803,3.42918140817935,19.453179552365285,21.888106484069315,4.8342869972932965,4.8342869972932965,4.298425650232069,-4.276013929966852,24.46723617965206,27.43640162101733,-0.3147352364823047,0.045686912238289044,1.269623600968715,0.45140476284854814,-0.8647120573925088,0.7046792403576323,1.2775926697209496,-0.16332927608680609,0.004438587974200708,0.4438587974200707,-0.014064668981603983,0.313350556090726,0.08260355547771259,0.46388224568265,0.10821992921589153,0.019012172694631756,0.1615507683149161,0.054952272528242405,174.5150434896376,0.030961902586254565,-1.0090408708153624,-41.24616663587659,-45252000,-49197000,-184669000,197469000,37901000.0,5823500.0,30752500.0,64.30252211226903,23.101363492231265,114.72751294789134,5.676293681960531,15.799933199732799,3.1814513417176675,-1.1418564329972622,0.802142989100314,0.64,0.2617382516609548,0.004438587974200708,0.4438587974200708,-3.1772737338744803,-1.714619464989706,-0.014064668981603983,0.7046792403576323,0.5106049729165307,0.15882660053514325,64.30252211226903,114.72751294789134,179.03003506016037,23.101363492231265,155.92867156792911,0.5857343024783256,0.053726245730799545,-1.1632761187494527,-1.0756239600665558,0.0753494009462903,-0.5409647256759554,-1.1418564329972622,0.04078200406822926,0.9246505990537097,-21.651915240423797,0.053726245730799545,0.45140476284854814,1.269623600968715,0.3922508224984378,0.5593983074668494,1.2775926697209496,0.19573425959352528,2.812605682219373,5.676293681960531,15.799933199732799,3.1814513417176675,7.120631060393477,0.5029310853604289,7.412155920931092,6.610012931830778,4.496028080546831,0.17568088273929416,0.8917800707841085,0.19573425959352528,0.3981186556723127,9.240442192538001,5.1458253174297806,4.8342869972932965,4.8342869972932965,3.42918140817935,-3.1772737338744803,21.888106484069315,19.453179552365285,19.453179552365285,-1.714619464989706,3.42918140817935,-4.276013929966852,4.8342869972932965,0.64,MLAB,2024-03-31,2024,FY,-0.013205221836771955,-0.0033135616674021826,-7.919322056123787,-7.919322056123787,-274.3827956989247,-278.6470588235294,-278.6470588235294,0.012215748919376056,0.004663309084126096,-0.00017601798795908048,0.5771361183575743,0.7733691710397201,1.6226727309473605,0.49408486034846205,0.4909248170035306,1.2814518868555618,0.029549279366614563,0.09959423699624793,-19.06901576102653,-25.214310841715452,-72.73022447164428,0.4455481787579109,-0.06898393188351884,-0.6694010664984732,0.10848386885389133,-0.0020586965695881545,0.005991485737113652,-0.08216023125190948,-0.05678081519542751,-0.3249102491266666,-0.6349538731792381,0.3583971527908288,-0.05807711078574915,0.014642847392226276,235933333.0,250066667.0,270000000.0,-24116906.0,-25561604.0,-27599173.0,8.37667,8.6,10.925
