,symbol,price,beta,volAvg,mktCap,lastDiv,range,changes,companyName,currency,cik,isin,cusip,exchange,exchangeShortName,industry,website,description,ceo,sector,country,fullTimeEmployees,phone,address,city,state,zip,dcfDiff,dcf,image,ipoDate,defaultImage,isEtf,isActivelyTrading,isAdr,isFund,sharesout,cash,debt,enterprisevalue,revenuePerShareTTM,netIncomePerShareTTM,operatingCashFlowPerShareTTM,freeCashFlowPerShareTTM,cashPerShareTTM,bookValuePerShareTTM,tangibleBookValuePerShareTTM,shareholdersEquityPerShareTTM,interestDebtPerShareTTM,marketCapTTM,enterpriseValueTTM,peRatioTTM,priceToSalesRatioTTM,pocfratioTTM,pfcfRatioTTM,pbRatioTTM,ptbRatioTTM,evToSalesTTM,enterpriseValueOverEBITDATTM,evToOperatingCashFlowTTM,evToFreeCashFlowTTM,earningsYieldTTM,freeCashFlowYieldTTM,debtToEquityTTM,debtToAssetsTTM,netDebtToEBITDATTM,currentRatioTTM,interestCoverageTTM,incomeQualityTTM,dividendYieldTTM,dividendYieldPercentageTTM,payoutRatioTTM,salesGeneralAndAdministrativeToRevenueTTM,researchAndDevelopementToRevenueTTM,intangiblesToTotalAssetsTTM,capexToOperatingCashFlowTTM,capexToRevenueTTM,capexToDepreciationTTM,stockBasedCompensationToRevenueTTM,grahamNumberTTM,roicTTM,returnOnTangibleAssetsTTM,grahamNetNetTTM,workingCapitalTTM,tangibleAssetValueTTM,netCurrentAssetValueTTM,investedCapitalTTM,averageReceivablesTTM,averagePayablesTTM,averageInventoryTTM,daysSalesOutstandingTTM,daysPayablesOutstandingTTM,daysOfInventoryOnHandTTM,receivablesTurnoverTTM,payablesTurnoverTTM,inventoryTurnoverTTM,roeTTM,capexPerShareTTM,dividendPerShareTTM,debtToMarketCapTTM,dividendYielTTM,dividendYielPercentageTTM,peRatioTTM,pegRatioTTM,payoutRatioTTM,currentRatioTTM,quickRatioTTM,cashRatioTTM,daysOfSalesOutstandingTTM,daysOfInventoryOutstandingTTM,operatingCycleTTM,daysOfPayablesOutstandingTTM,cashConversionCycleTTM,grossProfitMarginTTM,operatingProfitMarginTTM,pretaxProfitMarginTTM,netProfitMarginTTM,effectiveTaxRateTTM,returnOnAssetsTTM,returnOnEquityTTM,returnOnCapitalEmployedTTM,netIncomePerEBTTTM,ebtPerEbitTTM,ebitPerRevenueTTM,debtRatioTTM,debtEquityRatioTTM,longTermDebtToCapitalizationTTM,totalDebtToCapitalizationTTM,interestCoverageTTM,cashFlowToDebtRatioTTM,companyEquityMultiplierTTM,receivablesTurnoverTTM,payablesTurnoverTTM,inventoryTurnoverTTM,fixedAssetTurnoverTTM,assetTurnoverTTM,operatingCashFlowPerShareTTM,freeCashFlowPerShareTTM,cashPerShareTTM,operatingCashFlowSalesRatioTTM,freeCashFlowOperatingCashFlowRatioTTM,cashFlowCoverageRatiosTTM,shortTermCoverageRatiosTTM,capitalExpenditureCoverageRatioTTM,dividendPaidAndCapexCoverageRatioTTM,priceBookValueRatioTTM,priceToBookRatioTTM,priceToSalesRatioTTM,priceEarningsRatioTTM,priceToFreeCashFlowsRatioTTM,priceToOperatingCashFlowsRatioTTM,priceCashFlowRatioTTM,priceEarningsToGrowthRatioTTM,priceSalesRatioTTM,enterpriseValueMultipleTTM,priceFairValueTTM,dividendPerShareTTM,symbol,date,calendarYear,period,revenueGrowth,grossProfitGrowth,ebitgrowth,operatingIncomeGrowth,netIncomeGrowth,epsgrowth,epsdilutedGrowth,weightedAverageSharesGrowth,weightedAverageSharesDilutedGrowth,dividendsperShareGrowth,operatingCashFlowGrowth,freeCashFlowGrowth,tenYRevenueGrowthPerShare,fiveYRevenueGrowthPerShare,threeYRevenueGrowthPerShare,tenYOperatingCFGrowthPerShare,fiveYOperatingCFGrowthPerShare,threeYOperatingCFGrowthPerShare,tenYNetIncomeGrowthPerShare,fiveYNetIncomeGrowthPerShare,threeYNetIncomeGrowthPerShare,tenYShareholdersEquityGrowthPerShare,fiveYShareholdersEquityGrowthPerShare,threeYShareholdersEquityGrowthPerShare,tenYDividendperShareGrowthPerShare,fiveYDividendperShareGrowthPerShare,threeYDividendperShareGrowthPerShare,receivablesGrowth,inventoryGrowth,assetGrowth,bookValueperShareGrowth,debtGrowth,rdexpenseGrowth,sgaexpensesGrowth,revenue+1,revenue+2,revenue+3,ebitda+1,ebitda+2,ebitda+3,eps+1,eps+2,eps+3
0,A,136.43,1.072,1698025,38963725850,0.956,124.16-155.35,0.74,"Agilent Technologies, Inc.",USD,0001090872,US00846U1016,00846U101,New York Stock Exchange,NYSE,Medical - Diagnostics & Research,https://www.agilent.com,"Agilent Technologies, Inc. provides application focused solutions to the life sciences, diagnostics, and applied chemical markets worldwide. The Life Sciences and Applied Markets segment offers liquid chromatography systems and components; liquid chromatography mass spectrometry systems; gas chromatography systems and components; gas chromatography mass spectrometry systems; inductively coupled plasma mass spectrometry instruments; atomic absorption instruments; microwave plasma-atomic emission spectrometry instruments; inductively coupled plasma optical emission spectrometry instruments; raman spectroscopy; cell analysis plate based assays; flow cytometer; real-time cell analyzer; cell imaging systems; microplate reader; laboratory software; information management and analytics; laboratory automation and robotic systems; dissolution testing; vacuum pumps, and measurement technologies. The Diagnostics and Genomics segment provides arrays for DNA mutation detection, genotyping, gene copy number determination, identification of gene rearrangements, DNA methylation profiling, gene expression profiling, next generation sequencing, target enrichment and genetic data management, and interpretation support software; and produces synthesized oligonucleotide. It also offers immunohistochemistry in situ hybridization, and hematoxylin and eosin staining and special staining; consumables, and software for quality control analysis of nucleic acid samples; and reagents for use in turbidimetry and flow cytometry, as well as develops liquid-based pharmacodiagnostics. The Agilent CrossLab segment provides GC and LC columns, sample preparation products, custom chemistries, and laboratory instrument supplies; and startup, operational, training, compliance support, software as a service, asset management, and consultation services. The company markets its products through direct sales, distributors, resellers, manufacturer's representatives, and electronic commerce. Agilent Technologies, Inc. was incorporated in 1999 and is headquartered in Santa Clara, California.",Mr. Rodney  Gonsalves,Healthcare,US,17400,800 227 9770,5301 Stevens Creek Boulevard,Santa Clara,CA,95051,52.31117,84.6788258874798,https://images.financialmodelingprep.com/symbol/A.png,1999-11-18,False,False,True,False,False,286000000.0,1329000000,3390000000,39329660000,22.762237762237763,4.506993006993007,6.1223776223776225,4.800699300699301,4.646853146853147,20.622377622377623,3.055944055944056,20.622377622377623,12.188811188811188,38963725850.0,41024725850.0,30.270737005430572,5.9852113440860215,22.283826384922904,28.378533029861618,6.615629026788742,6.615629026788742,6.301801205837173,23.672663502596652,23.429312307252996,29.879625528040787,0.033035204918221844,0.03523790320478297,0.5747711088504578,0.2861725476954246,1.189267166762839,2.0891820580474936,15.666666666666666,1.3584173778122575,0.0070072564685186535,0.7007256468518653,0.2125678820791311,0.0,0.07235023041474654,0.424109404018234,0.2158766419189035,0.05806451612903226,1.4708171206225682,0.01966205837173579,45.730301922921555,0.1372300851529633,0.1889475227206098,-10.979020979020978,2064000000,874000000,-1989000000,8866000000,1275500000.0,518500000.0,975000000.0,74.23348694316437,66.36363636363636,119.45454545454545,4.9169184290030215,5.5,3.0555555555555554,0.21303144238317565,1.3216783216783217,0.956,0.08700399990110289,0.0070072564685186535,0.7007256468518653,30.270737005430572,-3.6627591776571045,0.2125678820791311,2.0891820580474936,1.5762532981530344,0.7013192612137203,74.23348694316437,119.45454545454545,193.68803239770983,66.36363636363636,127.32439603407347,0.543778801843318,0.23102918586789556,0.23364055299539171,0.19800307219662058,0.1525312294543064,0.10881310146885025,0.21303144238317565,0.15114058888553913,0.8474687705456936,1.0113031914893618,0.23102918586789556,0.2861725476954246,0.5747711088504578,0.361895488477767,0.3649870801033592,15.666666666666666,0.516519174041298,2.008477449983045,4.9169184290030215,5.5,3.0555555555555554,3.661417322834646,0.5495525915920986,6.1223776223776225,4.800699300699301,4.646853146853147,0.26897081413210444,0.7841233580810966,0.516519174041298,38.91111111111111,4.632275132275132,2.6855828220858897,6.615629026788742,6.615629026788742,5.9852113440860215,30.270737005430572,28.378533029861618,22.283826384922904,22.283826384922904,-3.6627591776571045,5.9852113440860215,23.672663502596652,6.615629026788742,0.956,A,2024-10-31,2024,FY,-0.047270598565783695,0.020202020202020204,0.10222222222222223,0.10222222222222223,0.03951612903225806,0.052132701421801105,0.05727923627684948,-0.013605442176870748,-0.016891891891891893,0.04822381262199089,-0.011851015801354402,-0.06852103120759837,0.0708030170561475,0.36524474543669466,0.0799613644673153,1.819959375151134,0.8569151271572832,0.2360478346685242,1.9781239159092485,0.30315206542387063,0.11671701339412939,0.2817053433918921,0.3450106033756499,0.1472872582079714,0.7876567398119123,0.4401740877134249,0.21706604324956172,0.025561580170410533,-0.05722599418040737,0.1006225030196042,0.022985752632665706,0.23948811700182815,-0.004158004158004158,-0.04039167686658507,6827342312.0,7265798987.0,7732901752.0,1768810750.0,1882405008.0,2003420822.0,5.56249,6.10719,6.71329
0,ABT,113.04,0.722,5037611,196063358400,2.2,99.71-121.64,-0.79,Abbott Laboratories,USD,0000001800,US0028241000,002824100,New York Stock Exchange,NYSE,Medical - Devices,https://www.abbott.com,"Abbott Laboratories, together with its subsidiaries, discovers, develops, manufactures, and sells health care products worldwide. It operates in four segments: Established Pharmaceutical Products, Diagnostic Products, Nutritional Products, and Medical Devices. The Established Pharmaceutical Products segment provides generic pharmaceuticals for the treatment of pancreatic exocrine insufficiency, irritable bowel syndrome or biliary spasm, intrahepatic cholestasis or depressive symptoms, gynecological disorder, hormone replacement therapy, dyslipidemia, hypertension, hypothyroidism, Ménière's disease and vestibular vertigo, pain, fever, inflammation, and migraine, as well as provides anti-infective clarithromycin, influenza vaccine, and products to regulate physiological rhythm of the colon. The Diagnostic Products segment offers laboratory systems in the areas of immunoassay, clinical chemistry, hematology, and transfusion; molecular diagnostics systems that automate the extraction, purification, and preparation of DNA and RNA from patient samples, as well as detect and measure infectious agents; point of care systems; cartridges for testing blood; rapid diagnostics lateral flow testing products; molecular point-of-care testing for HIV, SARS-CoV-2, influenza A and B, RSV, and strep A; cardiometabolic test systems; drug and alcohol test, and remote patient monitoring and consumer self-test systems; and informatics and automation solutions for use in laboratories. The Nutritional Products segment provides pediatric and adult nutritional products. The Medical Devices segment offers rhythm management, electrophysiology, heart failure, vascular, and structural heart devices for the treatment of cardiovascular diseases; and diabetes care products, as well as neuromodulation devices for the management of chronic pain and movement disorders. Abbott Laboratories was founded in 1888 and is based in North Chicago, Illinois.",Mr. Robert B. Ford,Healthcare,US,114000,224 667 6100,100 Abbott Park Road,North Chicago,IL,60064-6400,-3.92743,117.9274296096079,https://images.financialmodelingprep.com/symbol/ABT.png,1980-03-17,False,False,True,False,False,1734455938.0,7558000000,14979000000,205166321491,23.76364777967626,3.3249619512675106,5.032125526385093,3.739501164543276,4.490168835871574,23.078130221143734,5.199324930905221,22.94437069752763,8.922106154996484,196063358400.0,203484358400.0,33.997381520984916,4.756856598005677,22.46366856456462,30.228701572617947,4.926698643871745,4.926698643871745,4.936903665963073,18.91997753602975,23.313973235563704,31.37285821769966,0.029414030000597224,0.03308114301891913,0.37639461252387174,0.20144978212921621,0.6900046490004649,1.5972352704334989,13.903225806451612,1.5192341166231507,0.019462137296532202,1.9462137296532203,0.6530258366568407,0.0,0.06744789771210909,0.4170477163914143,0.2568744271310724,0.05439503117645632,0.6954094292803971,0.01640099958754883,41.43073847053384,0.10711819685644983,0.13304572509574125,-9.358986668014163,8900000000,9018000000,-10526000000,50531000000,8027500000.0,4079500000.0,6813500000.0,81.48009316544145,78.86080017138877,133.18756360130683,4.4796217802412786,4.628408527516113,2.74049611037722,0.14737393548716834,1.292624361841817,2.2,0.07639877293869715,0.019462137296532202,1.9462137296532203,33.997381520984916,9.094299556863458,0.6530258366568407,1.5972352704334989,1.1400483156623271,0.5071802442625151,81.48009316544145,133.18756360130683,214.66765676674828,78.86080017138879,135.8068565953595,0.5470073028119465,0.16730960525996555,0.16444670888225732,0.13991799500206226,0.14915904396577162,0.07755930926892247,0.14737393548716834,0.1159888317018199,0.8508409560342284,0.9828886310904872,0.16730960525996555,0.20144978212921621,0.37639461252387174,0.24372398852169286,0.27346417161113645,13.903225806451612,0.5826824220575473,1.8684289878379736,4.4796217802412786,4.628408527516113,2.74049611037722,3.880708031258827,0.5543197589972565,5.032125526385093,3.739501164543276,4.490168835871574,0.21175728461557125,0.7431255728689276,0.5826824220575473,4.051996285979573,3.892952720785013,1.4527296937416778,4.926698643871745,4.926698643871745,4.756856598005677,33.997381520984916,30.228701572617947,22.46366856456462,22.46366856456462,9.094299556863458,4.756856598005677,18.91997753602975,4.926698643871745,2.2,ABT,2023-12-31,2023,FY,-0.08118571461297047,-0.09697686752886459,-0.2253049509686678,-0.2253049509686678,-0.1745276215202654,-0.1624365482233503,-0.1636828644501279,-0.010795003993154592,-0.008503401360544218,0.08637230115617149,-0.24214591378770484,-0.351742696053306,0.63893020689236,0.3279903446131078,0.18496589403721572,0.9501397480231146,0.16685810400304235,-0.06037428580034557,0.9833903679799277,1.4468323139506936,0.30177092760928964,0.36914958704535195,0.28038851950872434,0.20392555804542944,2.599345030303062,0.8237981189954574,0.42024184871563774,0.05580572531360566,0.06431232787947513,-0.016443214487224266,0.06356080716244915,-0.10403025513659968,-0.05090027700831025,-0.026582503556187766,45000227413.0,48327015008.0,51715879932.0,12072187955.0,12964663558.0,13873792615.0,5.15653,5.70442,6.25274
0,ADPT,7.05,1.447,1152277,1040431950,0.0,2.28-7.46,-0.15,Adaptive Biotechnologies Corporation,USD,0001478320,US00650F1093,00650F109,NASDAQ Global Select,NASDAQ,Biotechnology,https://www.adaptivebiotech.com,"Adaptive Biotechnologies Corporation, a commercial-stage company, develops an immune medicine platform for the diagnosis and treatment of various diseases. The company offers immunoSEQ, a platform and core immunosequencing product that is used to answer translational research questions, as well as to discover new prognostic and diagnostic signals; and T-Detect COVID for the confirmation of past COVID-19 infection. It also provides clonoSEQ, a clinical diagnostic product for the detection and monitoring of minimal residual disease in patients with multiple myeloma, B cell acute lymphoblastic leukemia, and chronic lymphocytic leukemia, as well as available as a CLIA-validated laboratory developed test for patients with other lymphoid cancers; and immunoSEQ T-MAP COVID for vaccine developers and researchers to measure the T-cell immune response to vaccines. In addition, the company offers a pipeline of clinical products and services that are used for the diagnosing, monitoring, and treatment of diseases, such as cancer, autoimmune conditions, and infectious diseases. It serves the life sciences research, clinical diagnostics, and drug discovery applications. Adaptive Biotechnologies Corporation has strategic collaborations with Genentech, Inc. for the development, manufacture, and commercialization of neoantigen directed T cell therapies for the treatment of a range of cancers; and Microsoft Corporation to develop diagnostic tests for the early detection of various diseases from a single blood test. The company was formerly known as Adaptive TCR Corporation and changed its name to Adaptive Biotechnologies Corporation in December 2011. Adaptive Biotechnologies Corporation was incorporated in 2009 and is headquartered in Seattle, Washington.",Mr. Chad M. Robins M.B.A.,Healthcare,US,709,206 659 0067,1165 Eastlake Avenue East,Seattle,WA,98109,0.0401863,9.31981,https://images.financialmodelingprep.com/symbol/ADPT.png,2019-06-27,False,False,True,False,False,147516398.0,38084000,91825000,809024957,1.2017782592549473,-1.323520657005196,-0.7433275316280431,-0.7764221574878747,1.6495047553967526,1.5155874399807403,0.6829681402605831,1.5169364425506104,0.07890648197632917,1040431950.0,1094172950.0,-5.326701901240006,5.868796324499949,-9.484378958168039,-9.083965163487143,4.647524973522275,4.647524973522275,6.171934826998793,-6.691984648787499,-9.978504464082151,-9.553175448552844,-0.18773342652555972,-0.11008408574919291,0.0,0.0,-0.3286810800892939,3.5188355187328106,-14.301202749140893,0.5614046764523677,0.0,0.0,0.0,0.4257397818165409,0.5707460430274929,0.21991706445409717,-0.04452226569268511,0.027538046727812186,0.24168316831683168,0.31776491691203845,6.721099324834699,-0.759688783691084,-0.4481283324267067,-0.37294158985633585,220718000,100749000,-26587000,441387000,38212000.0,8609000.0,12584500.0,84.03058404124502,32.78969301461603,53.32618419123039,4.3436565884255405,11.13154672833628,6.844667503136763,-0.7447057656805456,0.03309462585983153,0.0,0.0,0.0,0.0,-5.326701901240006,-0.6023270611402165,0.0,3.5188355187328106,3.3824049665057574,0.4346149017996736,84.03058404124502,53.32618419123038,137.35676823247542,32.78969301461603,104.56707521785938,0.5384302974921312,-0.9389898579664038,-1.101741857605397,-1.1013018806195778,-0.021216573912420194,-0.34957726506071557,-0.7447057656805456,-0.35352181770688434,0.9996006532902585,1.1733266853291362,-0.9389898579664038,0.0,0.0,0.0,0.0,-14.301202749140893,0.0,2.495859643477989,4.3436565884255405,11.13154672833628,6.844667503136763,1.8118842238665631,0.3174218361127723,-0.7433275316280431,-0.7764221574878747,1.6495047553967526,-0.6185230311029885,1.0445222656926851,0.0,0.0,-22.460671855796804,-22.460671855796804,4.647524973522275,4.647524973522275,5.868796324499949,-5.326701901240006,-9.083965163487143,-9.484378958168039,-9.484378958168039,-0.6023270611402165,5.868796324499949,-6.691984648787499,4.647524973522275,0.0,ADPT,2023-12-31,2023,FY,-0.08111900187795454,-0.256485529713734,-0.13412026815061992,-0.13412026815061992,-0.5811011904761905,-0.56,-0.56,0.013102936424988937,0.013102936424988937,0,0.15015901492293893,0.16612080242044194,2.2340144892007223,1.2338247863174705,0.5729292440415258,-2.274805181825687,-2.538645309156508,0.05087246062295098,-2.840332792130158,-2.5413545292425095,-0.4660057861570246,2.0026158073366642,1.8725032241071013,-0.6229142777931177,0,0,0,-0.0521257208477919,-0.00034594893793676054,-0.22820350284899785,-0.34433913583243975,1.124331030906835,-0.13854087304946527,-0.06309129419431923,,,,,,,,,
0,ADTX,0.196,1.081,4187719,2789903,0.0,0.178-253.6,-0.012,"Aditxt, Inc.",USD,0001726711,US0070256047,007025109,NASDAQ Capital Market,NASDAQ,Biotechnology,https://www.aditxt.com,"Aditxt, Inc., a biotech company, develops technologies focuses on improving the health of the immune system through immune mapping and reprogramming. It develops AditxtScore that allows individuals to understand, manage, and monitor their immune profiles in order to be informed about attacks on or by their immune system; and Apoptotic DNA Immunotherapy, a nucleic acid-based technology that utilizes an approach that mimics the way the body naturally induces tolerance to its own tissues. The company is also developing ADi products for organ transplantation, including skin grafting, autoimmune diseases, and allergies. Aditxt, Inc. has a license agreement with Loma Linda University and Leland Stanford Junior University. The company was formerly known as ADiTx Therapeutics, Inc. and changed its name to Aditxt, Inc. in July 2021. Aditxt, Inc. was incorporated in 2017 and is headquartered in Richmond, Virginia.",Mr. Amro A. Albanna,Healthcare,US,47,909 488 0844,737 North Fifth Street,Richmond,VA,23219,,0.0,https://images.financialmodelingprep.com/symbol/ADTX.png,2020-06-30,False,False,True,False,False,115672.0,328596,10110295,10277931,1.8336935472715956,-347.4312798257141,-120.37824192544436,-120.37824192544436,2.840756622173041,38.46292101805104,38.402889203956015,40.73344456739747,164.01028771007677,2789903.0,12571602.0,-0.0005641403390573287,13.153281126978364,-0.001628201216972346,-0.2003608487896635,0.004811770820798099,0.004811770820798099,59.27009481063803,-0.42278534029159864,-0.9028474636450914,-0.9028474636450914,-1772.6085705393577,-4.990995027425685,1.8761061514916317,0.29624323052556123,-0.3289603775513248,0.08569598252723902,-2.977142068670915,0.34613792148886224,0.0,0.0,0.0,70.2449706987511,68.33068215570444,0.00023271338206842183,0.0,0.0,0.0,3.6493326481445685,564.2886118819122,-2.217685866817255,-1.347131168436452,-208.32462480116192,-22280585,4442139,-23301881,-19168874,816483.0,6569511.0,327247.5,2110.377215273423,0.0,29.027830527165214,0.1729548619831503,0.0,12.574139829651438,-4.313814995488069,0.0,0.0,3.168456035926697,0.0,0.0,-0.0005641403390573287,6.807758179023564e-06,0.0,0.08569598252723902,0.08204403300567256,0.013484234948295988,2110.377215273423,29.027830527165214,2139.4050458005886,0.0,2139.4050458005886,-4.2757476179475455,-142.20911615363943,-190.70896764368928,-189.47074353981716,0.0036730383970791907,-1.3468176729861554,-4.313814995488069,-5.513977916338155,0.9935072581055259,1.3410460088764753,-142.20911615363943,0.29624323052556123,1.8761061514916317,0.0,0.652307687085412,-2.977142068670915,-1.5752135964120892,6.332992481088112,0.1729548619831503,0.0,12.574139829651438,0.06831655966454166,0.007108314707716986,-120.37824192544436,-120.37824192544436,2.840756622173041,-65.64796069908112,1.0,-1.5752135964120892,-1.5752135964120892,0.0,0.0,0.004811770820798099,0.004811770820798099,13.153281126978364,-0.0005641403390573287,-0.2003608487896635,-0.001628201216972346,-0.001628201216972346,6.807758179023564e-06,13.153281126978364,-0.42278534029159864,0.004811770820798099,0.0,ADTX,2023-12-31,2023,FY,-0.30902256041725795,-1.6688790913883165,-0.04516593573348904,-0.04516593573348904,-0.14850864093804406,0.8221334122755082,0.8221334122755082,5.520790200138026,5.520790200138026,0,0.1703820104371176,0.18312981387432756,0,0,0,0,0.6876000572501767,0.9448064188421978,-0.30043339256299967,0.9630293604275472,0.9265581298672784,3.292829744704586,1.0678690466703857,-0.9687163959813636,0,0,0,10.085959000759527,-0.21533786692460632,3.1525191451078594,-0.5273304778176483,4.3869741464679635,-0.026656956633962954,0.05839155028322941,1200000.0,1260000.0,1323000.0,-239999.0,-251999.0,-264599.0,-3678.8,-3741.2,-3804.8
