0,CTKB,6.79,1.321,664058,874626690,0.0,4.66-9.328,-0.04,"Cytek Biosciences, Inc.",USD,0001831915,US23285D1090,23285D109,NASDAQ Global Select,NASDAQ,Medical - Devices,https://cytekbio.com,"Cytek Biosciences, Inc., a cell analysis solutions company, provides cell analysis tools that facilitates scientific advances in biomedical research and clinical applications. It offers aurora and northern lights systems, which are spectrum flow cytometers that delivers cell analysis by utilizing the fluorescence signatures from multiple lasers to distinguish fluorescent tags on single cells; and aurora cell sorter system, which leverages full spectrum profiling technology to further broaden potential applications across cell analysis. The company also provides reagents and kits, including cFluor reagents, which are fluorochrome conjugated antibodies used to identify cells of interest for analysis on its instruments, as well as 25-color immunoprofiling assay that provides turnkey solutions for identifying major human immune subpopulations for TBNK cells, monocytes, dendritic cells, and basophils. In addition, it offers automated micro-sampling system and automated sample loader system, which are automated plate loaders to integrate seamlessly into the aurora and northern lights systems; SpectroFlo software that provides intuitive workflow from quality control to data analysis for aurora and northern lights systems; and customer support tools. The company serves pharmaceutical and biopharma companies, academic research centers, and clinical research organizations. It distributes its products through direct sales force and support organizations in North America, Europe, China, and the Asia-Pacific region; and through distributors or sales agents in European, Latin American, the Middle Eastern, and the Asia-Pacific countries. The company was formerly known as Cytoville, Inc. and changed its name to Cytek Biosciences, Inc. in August 2015. Cytek Biosciences, Inc. was founded in 1992 and is headquartered in Fremont, California.",Dr. Wenbin  Jiang Ph.D.,Healthcare,US,645,877 922 9835,47215 Lakeview Boulevard,Fremont,CA,94538,8.58092,-1.7609175312813379,https://images.financialmodelingprep.com/symbol/CTKB.png,2021-07-23,False,False,True,False,False,131003744.0,162272000,8992000,572480741,1.5359103019223634,-0.07754740200402212,0.2510920603918007,0.21909297493054855,2.120374513876489,2.9423815551408974,2.662427724203058,2.9423815551408974,0.01773995100475907,874626690.0,721346690.0,-87.55934853430456,4.346835097659162,27.041874559494133,30.472674029684345,2.3076544876161913,2.3076544876161913,3.5850439341981013,-136.28314566408463,21.929430595245332,25.13227963208139,-0.01142082503741121,0.03281628645473876,0.003206533441601399,0.0025161534609324425,28.95900245607406,6.213529308724939,-21.733455882352942,-3.2375984251968504,0.0,0.0,0.0,0.2226479797226778,0.20152079916505145,0.07466013606771628,0.12743965464826412,0.020833954574822323,0.41203066640456065,0.12680284280105364,2.265814648063461,-0.05215397064563125,-0.022349527335766502,1.792998374153337,327394000,348788000,284428000,392701000,48693000.0,4290000.0,48435000.0,95.47939963222503,21.684801781540767,188.31856065617143,3.8228141505490747,16.83206531824086,1.9382051282051282,-0.026044310450026406,0.03199908546125216,0.0,0.0014131743452740963,0.0,0.0,-87.55934853430456,-2.1558172934582562,0.0,6.213529308724939,5.46827077726643,2.584072487539214,95.47939963222504,188.31856065617146,283.79796028839644,21.684801781540767,262.11315850685565,0.549187416132399,-0.11751900998956315,-0.05919686397296357,-0.05048953829332538,0.147090912006472,-0.02068090858382903,-0.026044310450026406,-0.055192342255076104,0.852909004037528,0.5037216019622769,-0.11751900998956315,0.0025161534609324425,0.003206533441601399,0.0031962844486280026,0.0031962844486280026,-21.733455882352942,26.613268608414238,1.2743791232880977,3.8228141505490747,16.83206531824086,1.9382051282051282,7.02745180217938,0.4096077976328614,0.2510920603918007,0.21909297493054855,2.120374513876489,0.16348094031111773,0.8725603453517359,26.613268608414238,0.0,7.846851145038168,7.846851145038168,2.3076544876161913,2.3076544876161913,4.346835097659162,-87.55934853430456,30.472674029684345,27.041874559494133,27.041874559494133,-2.1558172934582562,4.346835097659162,-136.28314566408463,2.3076544876161913,0.0,CTKB,2023-12-31,2023,FY,0.17666243995220562,0.08370471606552182,-14.249178532311062,-14.249178532311062,-5.71583850931677,-5.677083333333334,-5.827956989247312,0.005740898292420779,-0.023664961339972656,0,1.431771727577467,1.0205439160142993,2.278138093522729,2.278138093522729,1.0438443678559237,1.3776551836469904,1.3776551836469904,-0.6574540901560322,0.2902828435409263,0.2902828435409263,-1.615239327790265,10.26625004328099,10.26625004328099,25.10855334757054,0,0,0,0.14849377865094956,0.2642148108153009,-0.04816199400934788,-0.0816025995393265,-0.2187465458162927,0.26659590337942507,0.3489399293286219,227509163.0,254253636.0,288700000.0,269958.0,301692.0,342565.0,0.21028,0.19023,0.18
0,CTLT,63.48,1.158,0,11522381760,0.0,,,"Catalent, Inc.",USD,0001596783,US1488061029,148806102,New York Stock Exchange,NYSE,Drug Manufacturers - Specialty & Generic,https://www.catalent.com,"Catalent, Inc., together with its subsidiaries, develops and manufactures solutions for drugs, protein-based biologics, cell and gene therapies, and consumer health products worldwide. It operates through four segments: Biologics, Softgel and Oral Technologies, Oral and Specialty Delivery, and Clinical Supply Services. The Softgel and Oral Technologies segment provides formulation, development, and manufacturing services for soft capsules for use in a range of customer products, such as prescription drugs, over-the-counter medications, dietary supplements, unit-dose cosmetics, and animal health medicinal preparations. The Biologics segment provides biologic cell-line; develops and manufactures cell therapy and viral based gene therapy; formulation, development, and manufacturing for parenteral dose forms, including vials, prefilled syringes, vials, and cartridges; and analytical development and testing services. The Oral and Specialty Delivery segment offers formulation, development, and manufacturing across a range of technologies along with integrated downstream clinical development and commercial supply solutions. This segment also offers oral delivery solutions platform comprising pre-clinical screening, formulation, analytical development, and current good manufacturing practices services. The Clinical Supply Services segment offers manufacturing, packaging, storage, distribution, and inventory management for drugs and biologics clinical trials. It also offers FastChain demand-led clinical supply services. The company serves pharmaceutical, biotechnology, and consumer health companies; and companies in other healthcare market segments, such as animal health and medical devices, as well as in cosmetics industries. Catalent, Inc. was incorporated in 2007 and is headquartered in Somerset, New Jersey.",Mr. Alessandro  Maselli,Healthcare,US,17000,732 537 6200,14 Schoolhouse Road,Somerset,NJ,08873,121.94199,-58.46198698258929,https://images.financialmodelingprep.com/symbol/CTLT.png,2014-07-31,False,False,False,False,False,182000000.0,335000000,4947000000,15635740000,24.296703296703296,-2.269230769230769,2.1923076923076925,0.5439560439560439,1.8406593406593406,19.46153846153846,2.0054945054945055,19.46153846153846,28.516483516483518,11522381760.0,16134381760.0,-27.97423728813559,2.6056946540027135,28.955789473684206,116.38769454545454,3.2618181818181817,3.2618181818181817,3.6486616372682046,35.382416140350884,40.437047017543854,162.9735531313131,-0.035747176578934614,0.008591973609456245,1.3929983060417843,0.5082406262875978,10.114035087719298,2.512024048096192,0.21875,-0.9661016949152542,0.0,0.0,0.0,0.0,0.002939846223428313,0.3272558714462299,0.7518796992481203,0.06784260515603799,0.6122448979591837,0.014925373134328358,31.522392716980576,0.007863531952568567,-0.0632368703108253,-24.51098901098901,1509000000,365000000,-3659000000,8357000000,1512000000.0,368000000.0,563500000.0,120.3459972862958,39.593578247035,58.38733005496094,3.0329218106995883,9.218666666666667,6.251356238698011,-0.1143727499307671,1.6483516483516483,0.0,0.42821007867734456,0.0,0.0,-27.97423728813559,-0.47487131198995597,0.0,2.512024048096192,1.9579158316633267,0.33567134268537074,120.3459972862958,58.38733005496095,178.73332734125674,39.593578247035005,139.13974909422174,0.21822704658525555,0.012663952962460425,-0.07847127996381728,-0.09339665309814564,-0.19020172910662825,-0.04254223320972394,-0.1143727499307671,0.00642939150401837,1.1902017291066282,-6.196428571428571,0.012663952962460425,0.5082406262875978,1.3929983060417843,0.579734219269103,0.5821142048135913,0.21875,0.08086745034454804,2.740824392998306,3.0329218106995883,9.218666666666667,6.251356238698011,1.2045764096976301,0.45550061804697156,2.1923076923076925,0.5439560439560439,1.8406593406593406,0.09023066485753053,0.24812030075187969,0.08086745034454804,8.3125,1.33,1.33,3.2618181818181817,3.2618181818181817,2.6056946540027135,-27.97423728813559,116.38769454545454,28.955789473684206,28.955789473684206,-0.47487131198995597,2.6056946540027135,35.382416140350884,3.2618181818181817,0.0,CTLT,2024-06-30,2024,FY,0.024555659494855005,-0.1009433962264151,-4.467153284671533,-4.467153284671533,-3.4956896551724137,-3.4999999999999996,-3.4999999999999996,0.0,0.0,0.0,0.02681992337164751,0.8167701863354038,0.5534341593773172,0.38657255217900727,0.01709418245034121,-0.025890092742072983,-0.13774869778760176,-0.4255164406109247,-42.72475578405293,-7.04954410271257,-2.6548519620342823,7.282028558691627,0.7079972028218322,-0.14555576723608732,0,0,-1,0.08825573314801946,-0.2486910994764398,-0.09543683917640512,-0.22243797195253517,0.014229738090327902,-1.0,0.12515042117930206,4628151000.0,4990888899.0,5417350000.0,654062583.0,705325666.0,765594281.0,1.0727,1.69365,2.39
0,CYRX,8.71,1.633,407524,430540526,0.0,5.32-20.11,0.22,"Cryoport, Inc.",USD,0001124524,US2290503075,229050307,NASDAQ Capital Market,NASDAQ,Integrated Freight & Logistics,https://www.cryoport.com,"Cryoport, Inc., a life sciences services company, provides temperature-controlled logistics solutions in the Americas, Europe, the Middle East, Africa, and the Asia Pacific. The company offers Cryoportal, a cloud-based logistics management platform that supports the management of shipments, which includes order entry, document preparation, customs documentation, courier management, real-time shipment tracking and monitoring, issue resolution, and regulatory compliance requirements; and CryoPort Express Shippers, which is used to ensure that the stability of shipped biologic commodities is maintained throughout the shipping cycle. It also provides information dashboards and validation documentation for shipments through data collected by the SmartPak Condition Monitoring System; and vacuum insulated aluminum dewars and cryogenic freezers systems. In addition, the company offers biological specimen cryopreservation storage and maintenance; archiving, monitoring, tracking, receipt, and delivery of samples; transportation of frozen biological specimens to and from customer locations; and management of incoming and outgoing biological specimens, as well as provides logistics support and management; and short-term logistics and engineering consulting services. It serves biopharma/pharma, animal health, and human reproductive medicine markets. The company was founded in 1999 and is headquartered in Brentwood, Tennessee.",Mr. Jerrell W. Shelton,Industrials,US,1100,949 470 2300,112 Westwood Place,Brentwood,TN,37027,1.12505,21.9449,https://images.financialmodelingprep.com/symbol/CYRX.png,2005-08-22,False,False,True,False,False,49417757.0,44665000,233366000,589479009,4.575541540665231,-3.2067015910900207,-0.1691901961475103,-0.6604508577756777,5.5175713458625815,8.470072812086554,3.8184654961171143,8.470072812086554,4.818996540049359,430540526.0,619241526.0,-2.716186633705228,1.9040945279572605,-51.480524275804335,-13.191388136527973,1.0283264610867426,1.0283264610867426,2.738637433495642,-5.014507498700361,-74.06309364908503,-18.97302304062749,-0.36816321367279226,-0.07580703331978556,0.5575289317011172,0.33254152030950535,-1.5280670623375745,5.702192418496395,-15.134575136040183,0.05276144079561804,0.0,0.0,-0.06310422293459879,0.0,0.08095067510492542,0.32756264561498505,-2.9036000478411674,0.1073666706469774,0.800903932435999,0.09348865390313693,24.720890137113617,-0.11084171751415099,-0.3358134153293225,0.684870217804503,288898000,188700000,67144000,637164000,41810500.0,12402500.0,23580500.0,70.15635987316077,0.0,61.672585354654956,5.2026644577897425,0.0,5.918350883152174,-0.3561318740589253,0.4912606616281674,0.0,0.5420302756818762,0.0,0.0,-2.716186633705228,-0.381352603372214,-0.06310422293459879,5.702192418496395,5.318852845912206,0.7269812334185126,70.15635987316077,61.672585354654956,131.82894522781572,0.0,131.82894522781572,0.3835427419033846,-0.31980912198767875,-0.7013307505539266,-0.7008354229964664,0.0007062681296506495,-0.22581348457104586,-0.3561318740589253,-0.11293153799783236,0.9992937318703493,2.1929666864879067,-0.31980912198767875,0.33254152030950535,0.5575289317011172,0.3515347469561459,0.3579573517727146,-15.134575136040183,-0.03582784124508283,1.676569383523026,5.2026644577897425,0.0,5.918350883152174,1.909834957852594,0.3222061516319566,-0.1691901961475103,-0.6604508577756777,5.5175713458625815,-0.036977086677899985,3.9036000478411674,-0.03582784124508283,-1.2948737803933716,-0.3444000494295012,-0.24392449747644193,1.0283264610867426,1.0283264610867426,1.9040945279572605,-2.716186633705228,-13.191388136527973,-51.480524275804335,-51.480524275804335,-0.381352603372214,1.9040945279572605,-5.014507498700361,1.0283264610867426,0.0,CYRX,2023-12-31,2022,FY,-0.01695065261276904,-0.043716846533747945,-2.609484704112337,-2.609484704112337,-1.6675327458280877,-1.907894736842105,-1.907894736842105,-0.005101690142311389,-0.005101690142311389,-1.0,0.5910318746623446,-0.7528025184275184,6.854033806880562,5.879233537643106,1.3464199951347924,0.9845228651692862,0.8692945946323595,0.9596884777544832,0.544123215854014,-5.0324752999362605,-1.411433681044774,20.005865431654335,6.343354810800719,0.011580712694817058,0,0.0,-1,-0.040676729445027135,-0.05318303345617458,-0.07798056502744656,-0.11569443433976304,-0.04566330510107637,0.14743671288640123,0.22343925700720504,244960670.0,265423727.0,280500000.0,-97762375.0,-105929062.0,-111945915.0,-1.03117,-0.87312,-0.77
0,DGX,152.27,0.891,822069,16995616050,2.96,123.04-165.32,0.35,Quest Diagnostics Incorporated,USD,0001022079,US74834L1008,74834L100,New York Stock Exchange,NYSE,Medical - Diagnostics & Research,https://www.questdiagnostics.com,"Quest Diagnostics Incorporated provides diagnostic testing, information, and services in the United States and internationally. The company develops and delivers diagnostic information services, such as routine testing, non-routine and advanced clinical testing, anatomic pathology testing, and other diagnostic information services. It offers diagnostic information services primarily under the Quest Diagnostics brand, as well as under the AmeriPath, Dermpath Diagnostics, ExamOne, and Quanum brands to patients, clinicians, hospitals, independent delivery networks, health plans, employers, direct contract entities, and accountable care organizations through a network of laboratories, patient service centers, phlebotomists in physician offices, call centers and mobile paramedics, nurses, and other health and wellness professionals. The company also provides risk assessment services for the life insurance industry; and healthcare organizations and clinicians robust information technology solutions. Quest Diagnostics Incorporated was founded in 1967 and is headquartered in Secaucus, New Jersey.",Mr. James E. Davis,Healthcare,US,50000,973 520 2700,500 Plaza Drive,Secaucus,NJ,07094,-47.71944,201.2294422602123,https://images.financialmodelingprep.com/symbol/DGX.png,1996-12-17,False,False,True,False,False,112000000.0,764000000,6970000000,23594000000,85.16964285714286,7.508928571428571,12.473214285714286,9.133928571428571,6.821428571428571,61.794642857142854,-30.357142857142858,60.794642857142854,57.544642857142854,16995616050.0,23201616050.0,20.278525564803807,1.7816978771359682,12.207759484609879,16.61350542521994,2.504661477456308,2.504661477456308,2.4322901824090577,13.034615758426968,16.60817183249821,22.6799765884653,0.04931324996012721,0.060191992863947996,0.9180496401821119,0.38838148493320906,3.486516853932584,1.2538240917782026,6.855670103092783,1.643529411764706,0.01943915413410389,1.9439154134103893,0.38882282996432815,0.0,0.0,0.6412550481515998,0.2677165354330709,0.03920746409476884,0.8008565310492506,0.008386623335779431,101.34746761338148,0.07942057460968727,0.1456529269137513,-65.05357142857143,531000000,-3400000000,-6551000000,13606000000,1347500000.0,1264000000.0,183000000.0,52.65122130202327,73.31655567601052,10.401115068917454,6.932412790697675,4.978411719352351,35.09239130434783,0.12856869864322568,3.3392857142857144,2.96,0.3678007305889921,0.01943915413410389,1.943915413410389,20.278525564803807,75.94307824019188,0.38882282996432815,1.2538240917782026,1.1658699808795412,0.3652007648183556,52.65122130202327,10.401115068917454,63.05233637094073,73.31655567601054,-10.264219305069794,0.3230946640109026,0.13942761295733305,0.11667889715903135,0.08816437781738128,0.22012578616352202,0.05225225225225225,0.12856869864322568,0.09497964721845319,0.7556154537286612,0.8368421052631579,0.13942761295733305,0.38838148493320906,0.9180496401821119,0.45339969495063015,0.47863705972434917,6.855670103092783,0.2234842425211966,2.363783228080482,6.932412790697675,4.978411719352351,35.09239130434783,3.463689179375454,0.592668530599565,12.473214285714286,9.133928571428571,6.821428571428571,0.14645141000104833,0.7322834645669292,0.2234842425211966,2.316749585406302,3.735294117647059,1.992867332382311,2.504661477456308,2.504661477456308,1.7816978771359682,20.278525564803807,16.61350542521994,12.207759484609879,12.207759484609879,75.94307824019188,1.7816978771359682,13.034615758426968,2.504661477456308,2.96,DGX,2023-12-31,2023,FY,-0.06384701001720125,-0.13748907660937956,-0.11624649859943978,-0.11624649859943978,-0.09725158562367865,-0.06527093596059107,-0.057644110275689324,-0.034482758620689655,-0.0423728813559322,0.06627634660421534,-0.259604190919674,-0.3424657534246575,0.7571068729758906,0.49177684617865214,0.17297415946351002,1.6476774758983348,0.2871428571428571,-0.2409690060562878,0.36513545347467613,0.4089673913043477,-0.2859888190076869,1.1680597771023304,0.46827070552147243,0.11641884894215122,1.3034749034749034,0.4334049409237379,0.26491101491101493,0.012552301255230125,-0.010416666666666666,0.09231128768403833,0.10657803990582418,0.18952834270878408,0,-0.13820704375667023,10710937694.0,11134342281.0,11582700000.0,2409570906.0,2504821519.0,2605685677.0,9.72877,10.55615,11.62333
0,DHR,238.2,0.881,2943695,172045905000,1.08,222.53-281.7,3.36,Danaher Corporation,USD,0000313616,US2358511028,235851102,New York Stock Exchange,NYSE,Medical - Diagnostics & Research,https://www.danaher.com,"Danaher Corporation designs, manufactures, and markets professional, medical, industrial, and commercial products and services worldwide. The company operates through three segments: Life Sciences, Diagnostics, and Environmental & Applied Solutions. The Life Sciences segment provides mass spectrometers; flow cytometry, genomics, lab automation, centrifugation, particle counting and characterization; microscopes; genomics consumables; and Gene and Cell Therapy. This segment also offers bioprocess technologies, consumables, and services; and filtration, separation, and purification technologies to the pharmaceutical and biopharmaceutical, food and beverage, medical, and life sciences companies, as well as universities, medical schools and research institutions, and various industrial manufacturers. The Diagnostics segment provides chemistry, immunoassay, microbiology, and automation systems, as well as hematology, molecular, acute care, and pathology diagnostics products. This segment offers clinical instruments, reagents, consumables, software, and services for hospitals, physicians' offices, reference laboratories, and other critical care settings. The Environmental & Applied Solutions segment offers instrumentation, consumables, software, services, and disinfection systems to analyze, treat, and manage ultra-pure, potable, industrial, waste, ground, source, and ocean water in residential, commercial, industrial, and natural resource applications. This segment also provides instruments, software, services, and consumables for various color and appearance management, packaging design and quality management, packaging converting, printing, marking, coding, and traceability applications for consumer, pharmaceutical, and industrial products. The company was formerly known as Diversified Mortgage Investors, Inc. and changed its name to Danaher Corporation in 1984. Danaher Corporation was founded in 1969 and is headquartered in Washington, the District of Columbia.",Mr. Rainer M. Blair,Healthcare,US,61000,202 828 0850,"2200 Pennsylvania Avenue, NW",Washington,DC,20037-1701,16.62949,222.17551091885665,https://images.financialmodelingprep.com/symbol/DHR.png,1978-12-29,False,False,True,False,False,723000000.0,2627000000,17524000000,214040120000,27.704011065006917,5.383125864453666,8.697095435684647,6.929460580912863,3.6334716459197787,70.9612724757953,-14.8298755186722,70.95297372060857,24.645919778699863,172045905000.0,186942905000.0,44.24938335046248,8.58941113330005,27.388454198473283,34.3405,3.357153160880329,3.357153160880329,9.333145531702447,26.120288528713147,29.730105756997457,37.31395309381238,0.0225991849893101,0.029120135117426945,0.34160509951461043,0.21737889970849097,2.0814587117507335,1.370758958986238,13.488135593220338,1.8775753956404897,0.004534005037783376,0.45340050377833757,0.1986125385405961,0.0,0.0689465801298053,0.7694225640389506,0.2032442748091603,0.06380429355966051,0.568,0.012830753869196205,92.70300820304838,0.051114664753551656,0.20938239724553476,-31.41597510373444,2721000000,-10722000000,-19250000000,69591000000,3402500000.0,1620500000.0,2674500000.0,63.90688966550175,71.99851687059696,120.80954146582621,5.711434274308526,5.069548872180451,3.0212845407020166,0.07480156060809902,1.7676348547717842,1.08,0.10185653648658478,0.004534005037783376,0.4534005037783376,44.24938335046248,-6.294474781603283,0.1986125385405961,1.370758958986238,1.0058591088704183,0.35795067447881185,63.906889665501744,120.80954146582623,184.71643113132797,71.99851687059696,112.717914260731,0.5960559161258113,0.19865202196704942,0.1891163255117324,0.19430853719420868,0.1158922914466737,0.0482788562922533,0.07480156060809902,0.05430154484415088,1.027455121436114,0.951997989444584,0.19865202196704942,0.21737889970849097,0.34160509951461043,0.24139715777176404,0.25462418086976735,13.488135593220338,0.3588221867153618,1.5714731281311527,5.711434274308526,5.069548872180451,3.0212845407020166,4.135866198637208,0.24846492588227997,8.697095435684647,6.929460580912863,3.6334716459197787,0.31392910634048926,0.7967557251908397,0.3588221867153618,5.24,4.92018779342723,3.0658215504631885,3.357153160880329,3.357153160880329,8.58941113330005,44.24938335046248,34.3405,27.388454198473283,27.388454198473283,-6.294474781603283,8.58941113330005,26.120288528713147,3.357153160880329,1.08,DHR,2023-12-31,2023,FY,-0.24088843697372184,-0.25938044223969603,-0.40124309392265195,-0.40124309392265195,-0.33915938410320434,-0.34285714285714286,-0.33817427385892124,0.015721969383533305,0.00814000814000814,-0.011867900945627678,-0.15905622725672028,-0.21528437627256686,0.18089200120422652,0.14238699104021846,0.027964133436135023,0.8882807444723799,0.6943802973665208,0.10651888634598033,0.6705115076950979,0.7095263115881405,0.25288165587262984,1.2579467178885753,0.8032946020697996,0.28968358993800086,13.891619203239891,0.8019869103640956,0.2800384150481016,-0.06149796602057909,-0.16591639871382638,0.0016360403082394783,0.05134855020636998,-0.007165726482695533,-0.13868194842406878,-0.1484264913104744,25066519400.0,26983199383.0,29253794669.0,7595165081.0,8175919858.0,8863911108.0,8.32033,9.32277,10.46272
